name,title_es,description_es,title_en,description_en,title_ca,description_ca
alojamientos,Alojamiento Turístico,"Lugar donde una persona o un grupo de personas se hospeda, se aposenta o acampa.",Lodging Business,"A lodging business, such as a motel, hotel, or inn.",Allotjament turístic,"Un negoci d'allotjament, com ara un motel, un hotel o una fonda."
recursos,Recursos Turísticos,"Conjunto de los bienes y servicios que, por medio de la actividad del hombre y de los medios con los que cuenta, hacen posible la actividad turística y satisfacen las necesidades de la demanda.",Tourist Attraction,"A tourist attraction. In principle any Thing can be a TouristAttraction, from a Mountain and LandmarksOrHistoricalBuildings to a LocalBusiness. This Type can be used on its own to describe a general TouristAttraction, or be used as an additionalType to add tourist attraction properties to any other type",Recursos turístics,"Una atracció turística. En principi, qualsevol cosa pot ser una turista, des d’una muntanya i una destinació de terres de combustibles fins a una localitat local. Aquest tipus es pot utilitzar per si sol per descriure una turisme general o ser utilitzat com a tipus addicional per afegir propietats d’atracció turística a qualsevol altre tipus"
perfil,Caracteristicas de la Demanda,"la cantidad de productos y/o servicios turísticos que pueden ser adquiridos o se han adquirido por parte de los turistas, motivados por intereses varios (cultural, ocio, relax, etc.).",Tourist Type,"Tipo de turista para quien un determinado destino, recurso o servicio, o evento está destinado, por ejemplo, turismo activo.",Característiques de la demanda,"Tipo de Turista Para Quien Un determinat Destino, Recurso O Servicio, O Evento Está Destinado, Por Ejemplo, Turismo Activo."
empresas,Empresas Turísticas,Empresa u organización que de forma directa produce bienes de consumo o servicios relacionados con la actividad o la demanda turística.,Local Business,"A particular physical business or branch of an organization. Examples of LocalBusiness include a restaurant, a particular branch of a restaurant chain, a branch of a bank, a medical practice, a club, a bowling alley, etc.",Empreses turístiques,"Un negoci físic o una branca particular d’una organització. Entre els exemples de locals, hi ha un restaurant, una sucursal particular d’una cadena de restaurants, una sucursal d’un banc, una pràctica mèdica, un club, una bolera, etc."
empleo,Empleo Turistico,"el número de puestos de trabajos generados o atribuibles al consumo por parte de los visitantes, de los bienes y servicios producidos por las distintas industrias características de Turismo",Employee,Someone working for this organization.,Ocupació turística,Algú que treballa per a aquesta organització.
transporte,Transporte,"Conjunto de empresas mercantiles públicas o privadas que poseen una infraestructura y unos bienes de equipo para transportar o trasladar personas, equipajes y mercancías de un lugar a otro",Travel Action,"The act of traveling from a fromLocation to a destination by a specified mode of transport, optionally with participants",Transportar,"L’acte de viatjar des d’una destinació a una destinació mitjançant un mode de transport especificat, opcionalment amb els participants"
otros,Otros,Datos sobre turismo sin categorizar,Others,Uncategorized tourism data,Altres,Fins a les dades turístiques classificades
